{
  "$schema": "./schemas/workflow-cache.schema.json",
  "$id": "ai/workflow-cache.json",
  "schemaVersion": 1,
  "updatedAt": "2026-07-13T12:45:00Z",
  "entries": [
    {
      "id": "phase-2b-handoff-context",
      "kind": "HANDOFF_CONTEXT",
      "status": "FRESH",
      "key": {
        "paths": [
          {
            "path": "ai/agent-handoff.json",
            "sha256": "c22d8afd14a774654641a4a4ecb18f74713710c8022d01199fecf0ff3bba47d1"
          }
        ],
        "environmentFingerprint": null
      },
      "summary": "Phase 2B through Phase 3A reusable handoff context linking skill contracts, verification gates, signed native snapshot policy, Phase 2A context-cache recovery, and Issue-backed work logs.",
      "evidenceRefs": [
        "ai/agent-handoff.json",
        "ai/work-logs/issue-5/README.md",
        "ai/work-logs/issue-6/README.md",
        "ai/verification-gates.md",
        "ai/verification-policy.json",
        "scripts/ai/verification-gate.sh",
        "ai/work-logs/issue-7/README.md",
        "ai/native-runtime-adapters.json",
        "ai/native-runtime-adapters.md",
        "ai/schemas/native-runtime-snapshot.schema.json",
        "ai/work-logs/issue-10/README.md"
      ],
      "createdAt": "2026-07-13T00:00:00Z"
    }
  ],
  "handoffNotes": [
    {
      "id": "phase-2b-skills-handoff",
      "summary": "Use ai/agent-handoff.json and ai/skill-catalog.json when dispatching or reviewing Phase 2B skill/handoff reuse work.",
      "createdAt": "2026-07-13T00:00:00Z"
    },
    {
      "id": "phase-2c-verification-gates",
      "summary": "Use ai/verification-gates.md, ai/verification-policy.json, and scripts/ai/verification-gate.sh for Phase 2C verification completeness and task/change applicability mapping.",
      "createdAt": "2026-07-13T00:00:00Z"
    },
    {
      "id": "phase-3a-native-snapshot-trust",
      "summary": "Use ai/native-runtime-adapters.json, ai/native-runtime-adapters.md, and the native runtime snapshot schema for Phase 3A claimed/trusted status, ephemeral Ed25519 verification, signed task/event-set binding, and signed resolutionEventIds binding; runtime snapshots are not reusable cache evidence.",
      "createdAt": "2026-07-13T11:47:29Z"
    }
  ],
  "invalidationEvents": []
}
